{
  "$schema": "https://json-schema.org/draft/2020-12/schema",
  "$id": "https://github.com/bespokelabsai/conjecture-bench/problems/schemas/source.schema.json",
  "title": "Open-problem database source",
  "description": "Attribution and provenance for one upstream family collection. Every family record traces to exactly one of these. Credit is a gate, not a courtesy: a source without complete attribution does not validate.",
  "type": "object",
  "required": [
    "slug",
    "name",
    "maintainers",
    "homepage",
    "credit",
    "retrieval",
    "redistribution"
  ],
  "properties": {
    "slug": {"type": "string", "pattern": "^[a-z0-9]+(?:-[a-z0-9]+)*$"},
    "name": {"type": "string", "minLength": 3},
    "maintainers": {
      "type": "array",
      "minItems": 1,
      "items": {"type": "string", "minLength": 2},
      "description": "People or groups to name when this collection is cited."
    },
    "homepage": {"type": "string", "format": "uri"},
    "license": {
      "type": "string",
      "description": "Upstream licence identifier, or a short phrase when the site states no formal licence."
    },
    "credit": {
      "type": "object",
      "required": ["statement", "requested_citation"],
      "properties": {
        "statement": {
          "type": "string",
          "minLength": 20,
          "description": "One sentence naming who built the collection."
        },
        "requested_citation": {
          "type": "string",
          "minLength": 10,
          "description": "How the upstream project asks to be cited, quoted or paraphrased from its own instructions."
        },
        "citation_url": {"type": "string", "format": "uri"}
      },
      "additionalProperties": false
    },
    "retrieval": {
      "type": "object",
      "required": ["method", "urls", "retrieved"],
      "properties": {
        "method": {"type": "string", "minLength": 10},
        "urls": {
          "type": "array",
          "minItems": 1,
          "items": {"type": "string", "format": "uri"}
        },
        "retrieved": {"type": "string", "format": "date"},
        "upstream_version": {"type": "string"}
      },
      "additionalProperties": false
    },
    "redistribution": {
      "type": "object",
      "required": ["policy", "note"],
      "properties": {
        "policy": {
          "enum": ["pointer-only", "metadata-only", "full-mirror"],
          "description": "pointer-only: link plus a short quoted evidence line. metadata-only: also structured fields the upstream licence permits. full-mirror: upstream content copied wholesale."
        },
        "note": {"type": "string", "minLength": 20}
      },
      "additionalProperties": false
    },
    "caveats": {
      "type": "array",
      "items": {"type": "string", "minLength": 10},
      "description": "Limits the upstream project states about its own data, carried forward rather than dropped."
    }
  },
  "additionalProperties": false
}
